{
  "buildVersion": "0.24.0-rc1",
  "completeLedgers": "32570-6595042",
  "hostID": "ARTS",
  "ioLatencyMs": 1,
  "lastClose": {
    "convergeTimeS": 2.007,
    "proposers": 4
  },
  "loadFactor": 1,
  "peers": 53,
  "pubkeyNode": "n94wWvFUmaKGYrKUGgpv1DyYgDeXRGdACkNQaSe7zJiy5Znio7UC",
  "serverState": "full",
  "validatedLedger": {
    "age": 5,
    "baseFeeXRP": "0.00001",
    "hash": "4482DEE5362332F54A4036ED57EE1767C9F33CF7CE5A6670355C16CECE381D46",
    "reserveBaseXRP": "20",
    "reserveIncrementXRP": "5",
    "ledgerVersion": 6595042
  },
  "validationQuorum": 3
}
